{
  "$schema": "https://json-schema.org/draft/2020-12/schema",
  "$id": "https://krkinetics.local/schemas/manufacturer-evidence.schema.json",
  "title": "KR Kinetics Manufacturer Nutrition Evidence",
  "type": "object",
  "additionalProperties": false,
  "required": [
    "evidenceId",
    "brand",
    "product",
    "flavor",
    "market",
    "officialUrl",
    "accessedAt",
    "labelServing",
    "originalLabelValues",
    "conversion",
    "derivedUnrounded",
    "storedRounded",
    "evidenceHash"
  ],
  "properties": {
    "evidenceId": { "type": "string", "minLength": 1 },
    "brand": { "type": "string", "minLength": 1 },
    "product": { "type": "string", "minLength": 1 },
    "flavor": { "type": "string", "minLength": 1 },
    "market": { "type": "string", "minLength": 1 },
    "officialUrl": { "type": "string", "format": "uri" },
    "productUrl": { "type": ["string", "null"], "format": "uri" },
    "smartLabelUrl": { "type": ["string", "null"], "format": "uri" },
    "accessedAt": { "type": "string", "minLength": 8 },
    "labelServing": {
      "type": "object",
      "additionalProperties": false,
      "required": ["amount", "unit"],
      "properties": {
        "amount": { "type": "number", "exclusiveMinimum": 0 },
        "unit": { "type": "string", "minLength": 1 },
        "grams": { "type": ["number", "null"], "minimum": 0 }
      }
    },
    "originalLabelValues": {
      "type": "object",
      "additionalProperties": false,
      "required": [
        "declaredKcal",
        "proteinG",
        "carbsG",
        "fiberG",
        "fatG",
        "saturatedFatG"
      ],
      "properties": {
        "declaredKcal": { "type": ["number", "null"] },
        "proteinG": { "type": ["number", "null"] },
        "carbsG": { "type": ["number", "null"] },
        "fiberG": { "type": ["number", "null"] },
        "fatG": { "type": ["number", "null"] },
        "saturatedFatG": { "type": ["number", "null"] },
        "polyunsaturatedFatG": { "type": ["number", "null"] },
        "monounsaturatedFatG": { "type": ["number", "null"] }
      }
    },
    "conversion": {
      "type": "object",
      "additionalProperties": false,
      "required": ["formula", "targetBasis"],
      "properties": {
        "formula": { "type": "string", "minLength": 1 },
        "targetBasis": { "type": "string", "minLength": 1 },
        "method": {
          "type": "string",
          "enum": ["same_unit", "grams_ratio", "amount_ratio", "per_100_ml"]
        },
        "factor": { "type": "number" },
        "labelAmount": { "type": "number" },
        "canonicalAmount": { "type": "number" },
        "labelUnit": { "type": ["string", "null"] },
        "canonicalUnit": { "type": ["string", "null"] },
        "labelGrams": { "type": ["number", "null"] },
        "canonicalGrams": { "type": ["number", "null"] },
        "bottleMl": { "type": "number" }
      }
    },
    "derivedUnrounded": { "type": "object" },
    "storedRounded": { "type": "object" },
    "undeclaredNutrients": {
      "type": "array",
      "items": { "type": "string" }
    },
    "declaredZeroNutrients": {
      "type": "array",
      "items": { "type": "string" }
    },
    "canonicalPortion": {
      "type": "object",
      "additionalProperties": false,
      "properties": {
        "amount": { "type": "number" },
        "unit": { "type": "string" },
        "grams": { "type": ["number", "null"] },
        "labelFr": { "type": "string" },
        "labelEn": { "type": "string" }
      }
    },
    "networkComparison": {
      "type": "object",
      "additionalProperties": false,
      "properties": {
        "attempted": { "type": "boolean" },
        "matched": { "type": ["boolean", "null"] },
        "snapshotPath": { "type": ["string", "null"] },
        "snapshotSha256": { "type": ["string", "null"] },
        "notes": { "type": "string" }
      }
    },
    "evidenceHash": { "type": "string", "minLength": 64, "maxLength": 64 },
    "linkedFoodId": { "type": "string" },
    "batchId": { "type": "string" }
  }
}
